{
  "$schema": "http://json-schema.org/draft-07/schema#",
  "$id": "ruankaodaren-offline-batch-run-command-approval-request",
  "title": "Ruankaodaren Phase 6.13 Offline Batch Run Command Approval Request",
  "type": "object",
  "required": [
    "manifest_version",
    "manifest_type",
    "status",
    "created_for_phase",
    "inherits_from_phase",
    "created_at",
    "scope",
    "approval_status",
    "requested_decision",
    "run_command_approval_status",
    "run_command_approved",
    "batch_run_executed",
    "run_mode",
    "batch_id",
    "approved_items",
    "execution_authorization_status",
    "operational_mode_approval_status",
    "run_plan_status",
    "request_metadata",
    "requested_command",
    "phase_gates",
    "operational_gate_decisions",
    "item_boundary",
    "input_boundary",
    "allowed_future_outputs",
    "forbidden_phase6_13_artifacts",
    "no_go_confirmation",
    "operational_assertions",
    "human_decision_fields",
    "rollback_condition",
    "audit_condition",
    "phase_progression_history",
    "validation_expectations"
  ],
  "additionalProperties": false,
  "properties": {
    "manifest_version": { "const": "phase6.13" },
    "manifest_type": { "const": "offline_batch_run_command_approval_request" },
    "status": { "const": "offline_batch_run_command_approval_request_created" },
    "created_for_phase": { "const": "6.13" },
    "inherits_from_phase": {
      "type": "array",
      "items": { "type": "string", "enum": ["6.0", "6.1", "6.2", "6.3", "6.4", "6.5", "6.6", "6.7", "6.8", "6.9", "6.10", "6.11", "6.12"] },
      "minItems": 13,
      "maxItems": 13
    },
    "created_at": { "type": "string", "format": "date-time" },
    "scope": {
      "type": "object",
      "required": ["allowed", "forbidden"],
      "additionalProperties": false,
      "properties": {
        "allowed": { "type": "array", "items": { "type": "string" } },
        "forbidden": { "type": "array", "items": { "type": "string" } }
      }
    },
    "approval_status": { "const": "pending_human_review" },
    "requested_decision": { "const": "approve_offline_run_command" },
    "run_command_approval_status": { "const": "pending_human_review" },
    "run_command_approved": { "const": false },
    "batch_run_executed": { "const": false },
    "run_mode": { "const": "offline_existing_source_packet_only" },
    "batch_id": { "const": "phase6_1_batch_001" },
    "approved_items": {
      "type": "array",
      "items": { "type": "string" },
      "minItems": 1,
      "maxItems": 1
    },
    "execution_authorization_status": { "const": "execution_approved" },
    "operational_mode_approval_status": { "const": "operational_mode_approved" },
    "run_plan_status": { "const": "planned_not_executed" },
    "request_metadata": {
      "type": "object",
      "required": [
        "request_id",
        "request_type",
        "request_phase",
        "request_timestamp",
        "referencing_plan_phase",
        "referencing_decision_phase",
        "referencing_approval_phase",
        "request_scope"
      ],
      "additionalProperties": false,
      "properties": {
        "request_id": { "type": "string" },
        "request_type": { "const": "offline_batch_run_command_approval" },
        "request_phase": { "const": "6.13" },
        "request_timestamp": { "type": "string", "format": "date-time" },
        "referencing_plan_phase": { "const": "6.12" },
        "referencing_decision_phase": { "const": "6.11" },
        "referencing_approval_phase": { "const": "6.10" },
        "request_scope": { "const": "offline_run_command_approval_only" }
      }
    },
    "requested_command": {
      "type": "object",
      "required": [
        "command_id",
        "command_type",
        "command_status",
        "command_is_executable_now",
        "command_has_been_executed",
        "command_text_placeholder",
        "command_is_placeholder_only",
        "command_not_in_package_json",
        "command_arguments",
        "command_constraints"
      ],
      "additionalProperties": false,
      "properties": {
        "command_id": { "type": "string" },
        "command_type": { "const": "offline_batch_run" },
        "command_status": { "const": "pending_human_review" },
        "command_is_executable_now": { "const": false },
        "command_has_been_executed": { "const": false },
        "command_text_placeholder": { "type": "string" },
        "command_is_placeholder_only": { "const": true },
        "command_not_in_package_json": { "const": true },
        "command_arguments": {
          "type": "array",
          "items": {
            "type": "object",
            "required": ["argument", "value", "description"],
            "additionalProperties": false,
            "properties": {
              "argument": { "type": "string" },
              "value": { "type": "string" },
              "description": { "type": "string" }
            }
          },
          "minItems": 3,
          "maxItems": 3
        },
        "command_constraints": {
          "type": "array",
          "items": { "type": "string" },
          "minItems": 5,
          "maxItems": 5
        }
      }
    },
    "phase_gates": {
      "type": "object",
      "required": [
        "phase6_1_entry_allowed",
        "activation_allowed",
        "batch_executable",
        "execution_allowed",
        "crawler_allowed",
        "renderer_allowed",
        "recovery_allowed",
        "web_requests_allowed",
        "ai_learning_generation_allowed"
      ],
      "additionalProperties": false,
      "properties": {
        "phase6_1_entry_allowed": { "const": true },
        "activation_allowed": { "const": true },
        "batch_executable": { "const": true },
        "execution_allowed": { "const": true },
        "crawler_allowed": { "const": false },
        "renderer_allowed": { "const": false },
        "recovery_allowed": { "const": false },
        "web_requests_allowed": { "const": false },
        "ai_learning_generation_allowed": { "const": false }
      }
    },
    "operational_gate_decisions": {
      "type": "object",
      "required": [
        "crawler_gate_decision",
        "renderer_gate_decision",
        "recovery_gate_decision",
        "web_requests_gate_decision",
        "ai_learning_generation_gate_decision",
        "constraint"
      ],
      "additionalProperties": false,
      "properties": {
        "crawler_gate_decision": { "const": "not_required" },
        "renderer_gate_decision": { "const": "not_required" },
        "recovery_gate_decision": { "const": "not_required" },
        "web_requests_gate_decision": { "const": "not_required" },
        "ai_learning_generation_gate_decision": { "const": "not_allowed" },
        "constraint": { "type": "string" }
      }
    },
    "item_boundary": {
      "type": "object",
      "required": [
        "allowed_items",
        "approved_items",
        "deferred_items",
        "quarantined_items",
        "item_count",
        "source_layer_mutation_allowed",
        "constraints"
      ],
      "additionalProperties": false,
      "properties": {
        "allowed_items": { "type": "array", "items": { "type": "string" } },
        "approved_items": {
          "type": "array",
          "items": { "type": "string" },
          "minItems": 1,
          "maxItems": 1
        },
        "deferred_items": { "type": "array", "items": { "type": "string" } },
        "quarantined_items": { "type": "array", "items": { "type": "string" } },
        "item_count": { "type": "number" },
        "source_layer_mutation_allowed": { "const": false },
        "constraints": { "type": "array", "items": { "type": "string" } }
      }
    },
    "input_boundary": {
      "type": "object",
      "required": ["allowed_inputs", "forbidden_inputs"],
      "additionalProperties": false,
      "properties": {
        "allowed_inputs": {
          "type": "array",
          "items": {
            "type": "object",
            "required": ["source_phase", "artifact", "purpose", "access_mode"],
            "additionalProperties": false,
            "properties": {
              "source_phase": { "type": "string" },
              "artifact": { "type": "string" },
              "purpose": { "type": "string" },
              "access_mode": { "const": "read_only" }
            }
          },
          "minItems": 14,
          "maxItems": 14
        },
        "forbidden_inputs": {
          "type": "array",
          "items": { "type": "string" },
          "minItems": 8,
          "maxItems": 8
        }
      }
    },
    "allowed_future_outputs": {
      "type": "object",
      "required": ["description", "artifacts"],
      "additionalProperties": false,
      "properties": {
        "description": { "type": "string" },
        "artifacts": {
          "type": "array",
          "items": {
            "type": "object",
            "required": ["name", "purpose", "created_when", "status"],
            "additionalProperties": false,
            "properties": {
              "name": { "type": "string" },
              "purpose": { "type": "string" },
              "created_when": { "type": "string" },
              "status": { "const": "planned" }
            }
          },
          "minItems": 4,
          "maxItems": 4
        }
      }
    },
    "forbidden_phase6_13_artifacts": {
      "type": "object",
      "required": ["description", "artifacts"],
      "additionalProperties": false,
      "properties": {
        "description": { "type": "string" },
        "artifacts": {
          "type": "array",
          "items": { "type": "string" },
          "minItems": 12,
          "maxItems": 12
        }
      }
    },
    "no_go_confirmation": {
      "type": "object",
      "required": [
        "no_batch_execution_occurs",
        "no_crawler_runs",
        "no_renderer_runs",
        "no_recovery_runs",
        "no_web_requests_made",
        "no_source_layer_modified",
        "no_ai_learning_generated",
        "no_assets_captured",
        "no_raw_snapshots_created",
        "no_intermediate_json_created",
        "no_package_script_added_for_batch_run",
        "crawler_allowed_remains_false",
        "renderer_allowed_remains_false",
        "recovery_allowed_remains_false",
        "web_requests_allowed_remains_false",
        "ai_learning_generation_allowed_remains_false"
      ],
      "additionalProperties": false,
      "properties": {
        "no_batch_execution_occurs": { "const": true },
        "no_crawler_runs": { "const": true },
        "no_renderer_runs": { "const": true },
        "no_recovery_runs": { "const": true },
        "no_web_requests_made": { "const": true },
        "no_source_layer_modified": { "const": true },
        "no_ai_learning_generated": { "const": true },
        "no_assets_captured": { "const": true },
        "no_raw_snapshots_created": { "const": true },
        "no_intermediate_json_created": { "const": true },
        "no_package_script_added_for_batch_run": { "const": true },
        "crawler_allowed_remains_false": { "const": true },
        "renderer_allowed_remains_false": { "const": true },
        "recovery_allowed_remains_false": { "const": true },
        "web_requests_allowed_remains_false": { "const": true },
        "ai_learning_generation_allowed_remains_false": { "const": true }
      }
    },
    "operational_assertions": {
      "type": "object",
      "required": [
        "batch_execution_claimed",
        "crawler_output_claimed",
        "renderer_output_claimed",
        "recovery_output_claimed",
        "ai_learning_generation_claimed",
        "source_layer_mutation_declared",
        "web_requests_declared",
        "raw_snapshots_created",
        "intermediate_json_created",
        "assets_captured",
        "run_command_approved",
        "run_command_executed"
      ],
      "additionalProperties": false,
      "properties": {
        "batch_execution_claimed": { "const": false },
        "crawler_output_claimed": { "const": false },
        "renderer_output_claimed": { "const": false },
        "recovery_output_claimed": { "const": false },
        "ai_learning_generation_claimed": { "const": false },
        "source_layer_mutation_declared": { "const": false },
        "web_requests_declared": { "const": false },
        "raw_snapshots_created": { "const": false },
        "intermediate_json_created": { "const": false },
        "assets_captured": { "const": false },
        "run_command_approved": { "const": false },
        "run_command_executed": { "const": false }
      }
    },
    "human_decision_fields": {
      "type": "object",
      "required": [
        "human_decision",
        "human_decision_timestamp",
        "human_decision_notes",
        "human_reviewer_id",
        "description"
      ],
      "additionalProperties": false,
      "properties": {
        "human_decision": { "const": "pending" },
        "human_decision_timestamp": { "type": ["string", "null"] },
        "human_decision_notes": { "type": ["string", "null"] },
        "human_reviewer_id": { "type": ["string", "null"] },
        "description": { "type": "string" }
      }
    },
    "rollback_condition": {
      "type": "object",
      "required": ["phase6_13_rollback_needed", "reason", "approval_request_reversible", "future_execution_requirements"],
      "additionalProperties": false,
      "properties": {
        "phase6_13_rollback_needed": { "const": false },
        "reason": { "type": "string" },
        "approval_request_reversible": { "const": true },
        "future_execution_requirements": {
          "type": "array",
          "items": { "type": "string" },
          "minItems": 3,
          "maxItems": 3
        }
      }
    },
    "audit_condition": {
      "type": "object",
      "required": [
        "prior_phase_chain",
        "current_approval_status",
        "current_run_command_approval_status",
        "current_run_command_approved",
        "current_batch_run_executed",
        "current_run_mode",
        "current_operational_mode_approval_status",
        "current_execution_authorization_status",
        "current_run_plan_status",
        "current_operational_gates",
        "no_go_confirmation",
        "validation_commands",
        "commit_scope"
      ],
      "additionalProperties": false,
      "properties": {
        "prior_phase_chain": {
          "type": "array",
          "items": { "type": "string" },
          "minItems": 13,
          "maxItems": 13
        },
        "current_approval_status": { "const": "pending_human_review" },
        "current_run_command_approval_status": { "const": "pending_human_review" },
        "current_run_command_approved": { "const": false },
        "current_batch_run_executed": { "const": false },
        "current_run_mode": { "const": "offline_existing_source_packet_only" },
        "current_operational_mode_approval_status": { "const": "operational_mode_approved" },
        "current_execution_authorization_status": { "const": "execution_approved" },
        "current_run_plan_status": { "const": "planned_not_executed" },
        "current_operational_gates": {
          "type": "object",
          "required": [
            "phase6_1_entry_allowed",
            "activation_allowed",
            "batch_executable",
            "execution_allowed",
            "crawler_allowed",
            "renderer_allowed",
            "recovery_allowed",
            "web_requests_allowed",
            "ai_learning_generation_allowed"
          ],
          "additionalProperties": false,
          "properties": {
            "phase6_1_entry_allowed": { "const": true },
            "activation_allowed": { "const": true },
            "batch_executable": { "const": true },
            "execution_allowed": { "const": true },
            "crawler_allowed": { "const": false },
            "renderer_allowed": { "const": false },
            "recovery_allowed": { "const": false },
            "web_requests_allowed": { "const": false },
            "ai_learning_generation_allowed": { "const": false }
          }
        },
        "no_go_confirmation": { "const": true },
        "validation_commands": {
          "type": "array",
          "items": { "type": "string" },
          "minItems": 3,
          "maxItems": 3
        },
        "commit_scope": { "type": "string" }
      }
    },
    "phase_progression_history": {
      "type": "array",
      "items": {
        "type": "object",
        "required": ["phase", "outcome"],
        "additionalProperties": false,
        "properties": {
          "phase": { "type": "string" },
          "outcome": { "type": "string" }
        }
      },
      "minItems": 14,
      "maxItems": 14
    },
    "validation_expectations": {
      "type": "object",
      "required": [
        "schema_validation",
        "invariant_checks",
        "approval_status_must_be",
        "requested_decision_must_be",
        "run_command_approval_status_must_be",
        "run_command_approved_must_be",
        "batch_run_executed_must_be",
        "command_status_must_be",
        "command_is_executable_now_must_be",
        "command_has_been_executed_must_be",
        "operational_assertions_all_false",
        "no_go_confirmations_all_true",
        "item_constraints_satisfied",
        "future_outputs_planned_only",
        "forbidden_artifacts_explicitly_listed",
        "operational_gate_decisions_all_not_required_or_not_allowed"
      ],
      "additionalProperties": false,
      "properties": {
        "schema_validation": { "const": "must_pass" },
        "invariant_checks": { "const": "must_pass" },
        "approval_status_must_be": { "const": "pending_human_review" },
        "requested_decision_must_be": { "const": "approve_offline_run_command" },
        "run_command_approval_status_must_be": { "const": "pending_human_review" },
        "run_command_approved_must_be": { "const": false },
        "batch_run_executed_must_be": { "const": false },
        "command_status_must_be": { "const": "pending_human_review" },
        "command_is_executable_now_must_be": { "const": false },
        "command_has_been_executed_must_be": { "const": false },
        "operational_assertions_all_false": { "const": true },
        "no_go_confirmations_all_true": { "const": true },
        "item_constraints_satisfied": { "const": true },
        "future_outputs_planned_only": { "const": true },
        "forbidden_artifacts_explicitly_listed": { "const": true },
        "operational_gate_decisions_all_not_required_or_not_allowed": { "const": true }
      }
    }
  }
}
